10354179393,220262807,11/14/2018 08:07:48 PM,11/14/2018 08:46:24 PM,,,,,,Algunas veces,Muchas veces,Casi siempre,Muchas veces,Muchas veces,Algunas veces,Muchas veces,Algunas veces,Muchas veces,Casi siempre,Frustración,Por aveces no poder procesar rápidamente un tema nuevo y por no poder rendir correctamente académica mente esto debido a cancelación de materias.,Ansiedad,"me estresó mucho por culminar un trabajo y no poder rendir adecuadamente en el estudio, debido a que se me han dificultad algunas materias vistas ",Satisfacción,sentiría una gran satisfacción en ultimo semestres porque ya habré culminado la totalidad de la carrera y habré podido superarme a mi mismo como persona .,Frustración,"a nuestro grupo se nos a dificultado un poco el tema del trabajo, el cual pediría la posibilidad de aplazamiento de la entrega final, para poder entregar en su totalidad el trabajo asignado.",Alivio,un gran agradecimiento por habernos ayudado a encontrado el error y que sentimos un gran alivio por haber podido corregir el error .,Confusión,confusión porque no he hecho plagio en dicha acusación. ,Femenino,,,PIMO,,,,,
10354133480,220262807,11/14/2018 07:21:59 PM,11/15/2018 10:06:42 AM,,,,,,Algunas veces,Muchas veces,Algunas veces,Casi nunca,Nunca,Algunas veces,Muchas veces,Nunca,Muchas veces,Algunas veces,Satisfacción,"Pude superar aquellos miedos que sentía por pensar que iba a perder materias, y que ahora veo el resultado de mis esfuerzos.",Ansiedad,"Sentir que las materias se caen y no poderlas rescatar, también influye nuestra vida emocional, lo cual a veces amortigua o hace más peso.",Alivio,El saber que pude superarme a mí mismo y conseguir el título que tanto anhelé.,Frustración,"Qué se intentó hacer el trabajo, hubo el empeño de cada uno de los integrantes, no es justo!",Alivio,"Muchas gracias parce, en la buena! Le debo una! Usted es un verdadero compañero y amigo",Curiosidad,Esperemos no salgamos todos afectados y que el profesor tenga compasión de aquel muchacho.,Másculino,,,PIMO,,,,,
10354099707,220262807,11/14/2018 07:21:59 PM,11/14/2018 07:28:30 PM,,,,,,Casi nunca,Algunas veces,Algunas veces,Muchas veces,Siempre,Algunas veces,Casi siempre,Casi siempre,Casi siempre,Muchas veces,Frustración,"Es un sentimiento común durante momentos académicos, deportivos y personales, ya que a pesar del esfuerzo muchas veces no logro llegar a las metas planteadas",Temor,"Una semana en la que tuve malas notas en todos los parciales presentados, la situación personal fue difícil y en el deporte no se rindió de la manera esperada, temi no poder superarlo  temo aun",Satisfacción,Saber que me estoy graduando manteniendo mi beca y confiado de lo que aprendi,Ansiedad,"Necesito ayuda, no puedo hacer esto y enserio quiero aprender, pero solo no puedo",Disfrute,Un profundo y grato agradecimiento de cualquier forma posible,Temor,"En lo personal, prefiero perder antes que hacer copia, asi que dada la situación descrita significaría que alguien del otro grupo de trabajo se copio de mi y me causaría castigos a mi",Másculino,,PIMB,,,,,,
10354064554,220262807,11/14/2018 07:02:24 PM,11/14/2018 07:15:37 PM,,,,,,Algunas veces,Casi nunca,Casi siempre,Algunas veces,Muchas veces,Algunas veces,Algunas veces,Muchas veces,Muchas veces,Casi siempre,Frustración,"Frustración al no entender algo, estudiarlo más y no poder entender bien.",Decepción,Estudiar demasiado y que no sen las cosas como esperabas,Satisfacción,Tener la satisfacción de que logré cumplir con mis objetivos y a la vez disfrutar por todo lo vivido y aprendido,Frustración,"Que al haber estado trabajando en eso y no poder solucionarlo nos sentimos frustrados, ya que lo intentamos mucho tiempo pero no lo logramos.",Alivio,Me sentiría aliviado ya que con su ayuda por fin pudimos encontrar el error pero podría sentir un poco de temor ya que podrían surgir más problemas.,Curiosidad,curiosidad de saber cual fue el problema y un poco de temor ya que el profesor puede ponerse estricto con los demás y puede complicarse mucho la materia.,Másculino,,,,MBDA,,,,
10354051906,220262807,11/14/2018 06:54:59 PM,11/14/2018 06:59:18 PM,,,,,,Algunas veces,Casi siempre,Casi nunca,Casi nunca,Muchas veces,Algunas veces,Muchas veces,Casi nunca,Muchas veces,Nunca,Disfrute,,Frustración,,Disfrute,,Frustración,,Satisfacción,,Aburrimiento,,Másculino,,,,,,,ARSW,
10353967396,220262807,11/14/2018 06:09:49 PM,11/14/2018 06:14:18 PM,,,,,,Muchas veces,Algunas veces,Casi siempre,Muchas veces,Siempre,Algunas veces,Muchas veces,Siempre,Muchas veces,Siempre,Frustración,"Realizando el parcial de arsw del 2 corte, sumandole a frustacion las emociones de ansiedad, temor y confusion",Temor,Casi perder calculo diferencias y algunas materias de programacion,Satisfacción,Graduarme con honores y sin haber perdido ni una sola materia,Frustración,"que el tambien fue estudiante, que uno de alumno se esfuerza y da su maximo pero no lo valora, que tenga mas corazon con eso",Satisfacción,"Que estoy totalmente agradecido con el, que gracias por ayudarnos",Ansiedad,"que me siento ansioso por la situacion para que se aclare la verdad, y temeroso por alguna sancion",Másculino,,,,,,,ARSW,
10353965952,220262807,11/14/2018 06:08:29 PM,11/21/2018 05:19:19 PM,,,,,,Algunas veces,Algunas veces,Casi siempre,Muchas veces,Muchas veces,Algunas veces,Algunas veces,Muchas veces,Algunas veces,Muchas veces,Ansiedad,No saber cómo manejar la cancelación de una materia y no saber cuál es el proceso,Confusión,Quedar con un promedio inferior a tres y corree riesgo con mi situación,Satisfacción,Graduarme de la universidad rumbo a cumplir mis metas y sueños,Ansiedad,"Que todo el grupo está pidiendo el plazo, que por favor deje entregarlo después",Alivio,"Que muchas gracias por la ayuda prestada, quedo muy agradecido por lo hecho",Confusión,Que no entiendo por qué fui llamado a esa reunión si no he hecho copia,Másculino,,PIMB,,,,,,
10353949773,220262807,11/14/2018 06:01:12 PM,11/14/2018 06:09:20 PM,,,,,,Muchas veces,Casi nunca,Casi siempre,Algunas veces,Muchas veces,Casi siempre,Algunas veces,Casi siempre,Algunas veces,Muchas veces,Frustración,Obtuve una nota muy baja en un parcial que pensé había aprobado,Frustración,Sin importar cuanto me esforzara no obtenía los resultados que quería,Disfrute,,Ansiedad,,Disfrute,"Que es un verdadero crack, y que para lo que alguna vez me necesite que cuente conmigo",Frustración,Que es una verdadera pendejada que teniendo conocimiento de lo que esta en juego algunos idiotas se les ocurra la brillante idea de hacer copia,Másculino,,PIMB,,,,,,
10353931622,220262807,11/14/2018 05:51:49 PM,11/14/2018 06:04:08 PM,,,,,,Muchas veces,Algunas veces,Casi siempre,Muchas veces,Siempre,Muchas veces,Algunas veces,Muchas veces,Algunas veces,Casi siempre,Disfrute,en una clase que se me dificulta cuando saque buena nota en un parcial,Decepción,"En mi segundo semestre cuando tuve que ver unas materias con un profesor del programa que me quito toda la motivación de seguir la carrera ese semestre; al punto que casi dejo la escuela por eso. En la parte académica un gran profesor, pero como persona una porquería. Además de que me di cuenta que a la universidad no le interesa como están sus estudiantes ya que este profesor no le importo ni cinco que una de las causas de mi falta de motivación fue la muerte de un familiar",Alivio,de haber terminado la carrera para poder dedicarme a lo que me gusta y aplicar lo aprendido en el proceso,Ansiedad,que es un desconsiderado ya que no se ha atrasado el proyecto por falta de trabajo; y que además debería ayudar a solucionar los problemas que no se han podido dar solución. Sino para que está ahí,Alivio,"Claro porque ya sabría la causa de la falla, y me esmeraría en solucionar el problema",Confusión,Ya que no sabría como va a manejar la situación el profesor,Másculino,,,PIMO,,,,,
10353831383,220262807,11/14/2018 05:07:26 PM,11/14/2018 05:16:22 PM,,,,,,Algunas veces,Casi siempre,Algunas veces,Muchas veces,Casi siempre,Algunas veces,Casi siempre,Algunas veces,Casi siempre,Algunas veces,Satisfacción,Porque a sido un semestre en el que academicamente me a ido mejor,Confusión,Con algunos temas de ciertso temas de algunas materias ,Disfrute,Me gustaria que pueda disfrutar el ultomo semestre,Frustración,"que no estoy preparado para esta entrega, y preferiria entregarlo otro dia para sacar una buena nota",Alivio,Que gracias a el puede terminar el proyecto y que le regalaria algo o lo invitaria a hacer algo ,Decepción,Que la embarramos y eso tiene unas consecuencias y que esas consecuencias seran fuertes ya que el plagio es un delito,Másculino,,,,MBDA,,,,
10353775144,220262807,11/14/2018 04:46:01 PM,11/14/2018 04:49:18 PM,,,,,,Nunca,Casi nunca,Algunas veces,Muchas veces,Casi siempre,Siempre,Casi siempre,Muchas veces,Algunas veces,Casi nunca,Alivio,ewg dgwrh jur jrery rw ej  y k kyttu tutu tyu46u rht rhrw yr ytu 7 jn fgs dds fdfh t jy g h j kytkyk  tuky  yjy gr her y eryet uh ret jt 7u5y yjn5y i5ry 4t,Satisfacción,rhbe rhet  i64u5y5 thgfh gkyf dsvfs jtg hfdh   rw ej  y k kyttu tutu tyu46u rht rhrw yr ytu 7 jn fgsr ut j hg fngfm krythbdfjd ,Disfrute,tdn rgreh b fgj tyu rt ytj gjy tk ty ikyk uykuku ku ytyj h jtu ku  rw ej  y k kyttu tutu tyu46u rht rhrw yr ytu 7 jn fgs geru5y thgbg hj y57i rewwe f  ghrt jty,,,,,,,,,,,,,,,
10353666532,220262807,11/14/2018 04:05:50 PM,11/14/2018 04:17:43 PM,,,,,,Casi siempre,Algunas veces,Muchas veces,Casi siempre,Muchas veces,Algunas veces,Muchas veces,Casi siempre,Algunas veces,Casi nunca,Disfrute,Game jam de 48 horas cuando mi proyecto se encontraba en un estado deseado,Alivio,Momento en que tenia problemas con una materia y siendo el parcial mas alto sabia que habia logrado pasar,Disfrute,En mi ultimo semestre me sentiría feliz y orgulloso de mi mismo si logro realizar mis practicas en una empresa de desarrollo de videojuegos,Decepción,No realice una adecuada distribución de mi tiempo y dedicacion adecuada,Disfrute,Le agradeceria por colaborarme con mi proyecto ya que fue el proyecto definitivo del semestre  ,Alivio,tranquilidad por que en ningun momento e tenido la intención de realizar copia  ,Másculino,,,,,,PDSW,,
10353578001,220262807,11/14/2018 03:34:12 PM,11/16/2018 10:26:47 PM,,,,,,Algunas veces,Algunas veces,Algunas veces,Muchas veces,Siempre,Muchas veces,Casi siempre,Algunas veces,Casi siempre,Algunas veces,Curiosidad,Fue en alguna de las clases que tuve dónde me pareció muy interesante el tema.,Frustración,Con algunas materias ya que por más que estudiara no lograba conseguir que me fuera bien.,Satisfacción,Me gustaría poder disfrutar el sentimiento de haber podido terminar mi carrera y haber tenido unas grandes experiencias.,Frustración,le diría que siento frustración ya que no podré terminar el trabajo pero que igual asumo las consecuencias por no haberlo trabajado antes.,Alivio,"Le agradecería mucho por la ayuda, pero quedaría con cierto sentimiento de culpa.",Temor,que tengo miedo por lo que pueda llegar a pasar y más si no tengo culpa alguna o si fue un malentendido ,Másculino,,,,,,PDSW,,
10353487057,220262807,11/14/2018 03:01:03 PM,11/14/2018 03:14:03 PM,,,,,,Algunas veces,Muchas veces,Algunas veces,Casi nunca,Siempre,Casi nunca,Siempre,Algunas veces,Casi siempre,Casi nunca,Frustración,Un familiar estuvo hospitalizado y con mal pronóstico de vida,Frustración,"Los momentos en que debo cancelar, rendirme con algo para poder lograr el objetivo final",Satisfacción,Graduarme con mis amigos y que mi familia pueda estar conmigo,Decepción,No fui capaz de resolverlo en el tiempo pensado en que la gente podría,Satisfacción,Gracias por la ayuda y colaboración en solucionar el problema,Alivio,"  Que se lo quite hice y lo que no, estoy tranquila y no tengo que temer",Femenino,,,,,POOB,,,
10353448843,220262807,11/14/2018 02:47:10 PM,11/14/2018 04:41:55 PM,,,,,,Casi nunca,Algunas veces,Muchas veces,Muchas veces,Casi siempre,Algunas veces,Casi siempre,Muchas veces,Muchas veces,Muchas veces,Satisfacción,Haber terminado con satisfacción el curso en línea durante vacaciones ,Decepción,Entrar en seguimiento academico por mis resultados ese semestre ,Satisfacción,Poder aprobar todo con muy buenas notas y en compañía de mis amigos ,Ansiedad,"Que no hemos podido entender del todo como abordar ese tipo de problemas, le preguntariamos si nos pudiera volver a explicar o dar una guía ",Alivio,"Que nos ha sido de gran importancia su ayuda, que siento satisfacción al poder contar con alguien como el",Confusión,Que no entiendo el por que la gente hace trampa si el único afectado es uno mismo  y va en la responsabilidad de cada quien el ser honesto consigo mismo,Másculino,,,PIMO,,,,,
10353439719,220262807,11/14/2018 02:43:58 PM,11/14/2018 02:59:04 PM,,,,,,Muchas veces,Algunas veces,Casi siempre,Muchas veces,Algunas veces,Muchas veces,Algunas veces,Casi siempre,Muchas veces,Algunas veces,Satisfacción,"Pensaba que me estaba tirando POOB porque se suponia que llevaba muy bajitas las notas que mas valian y era bastante frustrante porque me habia esforzado muchisimo... y cuando el profesor me entrego las notas, todo mi esfuerzo y trasnocho valieron la pena, pues no me habia tirado ningun corte.",Decepción,"Cuando en segundo semestre me quise retirar de la carrera, porque pensaba que no era lo mio gracias a que mi profesor de programacion cada clase hacia que me gustara menos la carrera, porque como profesor excelente, pero era un asco de persona.",Satisfacción,Quisiera poder terminar la carrera viendo pocas materias en decimo semestre y poder sentirme tranquila de que aprendi durante la carrera lo que debia aprender. Salir bien preparada.,Frustración,"Que realmente el no poder resolver ese problema, me hace sentir que no se nada, que no he aprendido.",Alivio,"Que es un crack y que gracias, que si no hubiera sido por el, no sabria que hubieramos hecho.",Temor,"Pues que me preocupa que me acusen de plagio, porque yo nunca hago plagio y la acusacion me podria traer consecuencias para mi vida laboral.",Femenino,,,,,POOB,,,
10353429258,220262807,11/14/2018 02:40:15 PM,11/19/2018 12:41:35 PM,,,,,,Algunas veces,Algunas veces,Casi siempre,Casi siempre,Siempre,Muchas veces,Muchas veces,Algunas veces,Algunas veces,Casi siempre,Decepción,,Temor,,Alivio,,Frustración,,Satisfacción,,Curiosidad,,Másculino,,,PIMO,,,,,
10353419442,220262807,11/14/2018 02:36:43 PM,11/14/2018 02:46:13 PM,,,,,,Algunas veces,Muchas veces,Siempre,Siempre,Casi siempre,Algunas veces,Muchas veces,Casi nunca,Algunas veces,Algunas veces,Frustración,Sacamos 1.9 en la entrega de un sprint de COSW .......................................................................................................................,Ansiedad,Cuando tuvimos que terminar el proyecto de POOB durante toda la noche.,Disfrute,Cuando me gradue................................................................................,Temor,Que tome su tiempo para considerar las peticiones de los estudiantes teniendo en cuenta su carga academica......................,Alivio,Muchas gracias por la ayuda....................................................................................................,Temor,Miedo a que me expulsen de la universidad....................................................................................................,Másculino,,,,,,,,COSW
10353413333,220262807,11/14/2018 02:34:03 PM,11/20/2018 05:11:43 PM,,,,,,Algunas veces,Nunca,Siempre,Nunca,Muchas veces,Muchas veces,Nunca,Casi siempre,Algunas veces,Siempre,Frustración,"Problemas con compañeros, darse cuenta que quizas las personas que uno queria no eran quienes uno pensaba o que simplemente para ellos tu no tienes valor como ser humano, solo respuestas, no hqy sentimientos, no hay nada.",Frustración,,Alivio,"Bienestar, sentir que lo que se hizo tiene algun sentido, y que la vida acedemica y incluso la propia personalidad no impidieron disfrutar de los años de estudio.",Ansiedad,"No le diria nada, es mi responsabilidad por lo tanto es mejor trabajarle tanto como se pudo y asumir las consecuencias.",Alivio,"Le agradeceria por la ayuda, le diria que es muy benefica su ayuda.",Ansiedad,"Le diria que simplemente no me gusta tener problemas, que simplemente ello me molesta, que para mi ello no hace ningun bien, que lo mejor es huirle a ellos.",Másculino,,,,,POOB,,,
10353359185,220262807,11/14/2018 02:14:44 PM,11/21/2018 03:16:53 PM,,,,,,Algunas veces,Casi nunca,Casi siempre,Muchas veces,Muchas veces,Muchas veces,Algunas veces,Algunas veces,Muchas veces,Casi siempre,Satisfacción,Comenzamos a trabajar en un proyecto de grado interesante con una universidad en España,Temor,Cuando terminaba primeros semestres las entregas se acumulan y esto con el trabajo en los fines de semana es algo que se vuelve muy complicado para cumplir.,Satisfacción,Lograr obtener buenos resultados en los proyectos que me encamino y los resultados que obtengo.,Temor,"Me da mas miedo la nota que vaya a colocar que lo que pueda aprender, pero si lo permitiera podríamos solucionarlo con más tiempo así aprender no será un problema y la nota vendrá sola.",Satisfacción,"Gracias, por la ayuda, si necesita en algún momento algo, con gusto le ayudaría.",Curiosidad,"Siento curiosidad pero to miedo, porque no hago copia.",Másculino,,,,,,,,COSW
10353342796,220262807,11/14/2018 02:08:43 PM,11/14/2018 02:19:03 PM,,,,,,Casi siempre,Muchas veces,Casi siempre,Muchas veces,Casi siempre,Algunas veces,Casi siempre,Muchas veces,Siempre,Muchas veces,Temor,"El periodo de tiempo antes de decidir cancelar una materia sin saber las notas, no la cancele pero dieron las notas como 3 semanas despues del límite",Ansiedad,En los parciales de programación soy especialmente nervioso antes de entrar  ,Satisfacción,"Graduarme con un buen promedio, para poder seguir con los estudios que me intersan para mi futuro profesional",Ansiedad,Que por lo menos nos guíe para solucionar el problema que tenemos en el problema,Disfrute,"Que muchas gracias, que como lo hizo, que es muy bueno en esto.",Temor,Yo no lo hice y que pues que mal que alguien lo hiciera  ,Másculino,,,PIMO,,,,,
10353338595,220262807,11/14/2018 02:07:39 PM,11/14/2018 02:16:37 PM,,,,,,Muchas veces,Muchas veces,Casi siempre,Algunas veces,Casi siempre,Algunas veces,Algunas veces,Muchas veces,Muchas veces,Muchas veces,Frustración,"Primer parcial de Tpro perdido, sentir que no se ha aprendido nada.",Decepción,Problemas familiares que pudieron haber causado incovenientes en la carrera.,Satisfacción,Celebración de grado con todos los amigos y familiares que hicieron posible el logro.,Temor,Que es demasiado incomprensivo y no entiende el rol que significa ser estudiante.,Satisfacción,Gracias por salvarnos en ese momento tan decisivo.,Confusión,Que si ha realizado fraude exprese el motivo por el cual lo hizo.,Másculino,,,,MBDA,,,,
10353326317,220262807,11/14/2018 02:03:05 PM,11/14/2018 02:17:09 PM,,,,,,Algunas veces,Algunas veces,Muchas veces,Algunas veces,Casi nunca,Algunas veces,Casi nunca,Algunas veces,Muchas veces,Casi nunca,Disfrute,Crei que había perdido una materia pero al final la pasé ,Frustración,Cuando mi compañero de trabajo no vino y me tocobhaver todo,Satisfacción,Cuando me pase el examen de graduación y no tenga que realizar otro proyecto por mi cuenta,Alivio,"Que si todo el equipo intento resolverlo y no pudo, necesitamos algún repaso para poder resolverlo.",Satisfacción,Muy agradecido si nos explicará cómo lo resolvió para poder usar esa estrategia más adelante,Aburrimiento,Por que en cualquier caso me tocaría perder tiempo para solucionar algo que se puede hacer muy rápido ,Másculino,,,,MBDA,,,,
10353277720,220262807,11/14/2018 01:46:11 PM,11/14/2018 01:57:07 PM,,,,,,Muchas veces,Algunas veces,Siempre,Casi siempre,Casi siempre,Muchas veces,Algunas veces,Muchas veces,Muchas veces,Muchas veces,Ansiedad,Me cambié carrera y comencé a ver una materia muy dura y he pasado por mucho estrés que me ha generado ansiedad al no entender muchas cosas y al pensar que puedo perderla y me generaría muchos problemas para continuar con mis estudios ,Ansiedad,"Desde que inicié la universidad, he sufrido de mucha ansiedad.",Satisfacción,"Quisiera sentir satisfacción de  poder culminar mis estudios, haciendo valer cada esfuerzo hecho.",Temor,Que debería ser más comprensivo además de que no es la única materia que vemos y a la que debemos dedicarle tiempo.,Alivio,"Le agradecería, ya que ayudaría a que todo resulte bien y los esfuerzos hechos se vean reflejados.",Temor,Qué tengo miedo de que afecte mi proceso académico.,Femenino,,PIMB,,,,,,
10353277298,220262807,11/14/2018 01:44:18 PM,11/19/2018 03:09:56 PM,,,,,,Muchas veces,Casi nunca,Muchas veces,Muchas veces,Muchas veces,Muchas veces,Casi nunca,Muchas veces,Casi nunca,Casi siempre,Frustración,Al tratar de hacer los mejor por obtener buenos resultados y no lograrlos ,Frustración,,Alivio,Lograr culminar los estudios después de tantos inconvenientes ,Decepción,Actualmente estamos trabajando fuerte para lograr solucionar el problema pero que no se va a lograr en el tiempo estipulado y es como botar todo el trabajo a la basura.,Satisfacción,"Qué muchas gracias por su colaboración, es bueno tener compañeros que ayuden a otros sin esperar nada a cambio",Temor,"Que debe de existir algún error, sin embargo la copia es algo grave que puede llegar a ser causa de ser excluidos de la escuela, que aunque no sea verdad va ser difícil convencer al profesor de lo contrario ",Másculino,,,,,,,ARSW,
10353273121,220262807,11/14/2018 01:40:11 PM,11/14/2018 01:51:10 PM,,,,,,Algunas veces,Algunas veces,Casi siempre,Casi siempre,Algunas veces,Muchas veces,Algunas veces,Muchas veces,Algunas veces,Algunas veces,Ansiedad,Por sentir que me voy a colgar con las asignaciones.,Frustración,"Tener que cancelar y luego, en el siguiente semestre, perderlo; llegando a status de prueba academica.",Satisfacción,Quisiera poder terminar materias y dar por cumplida mi meta de terminar.,Temor,"Que no hemos podido resolverlo, que necesitamos mas tiempo, bsucar alternativas, buscar ayuda",Disfrute,"Disfrute, porque si se ha trabajado sería decepcionante tener un error que afecte la entrega.",Temor,A que se sufra una consecuencia de tipo disciplinario.,Másculino,,,,,,,ARSW,
10353224076,220262807,11/14/2018 01:27:33 PM,11/14/2018 01:34:01 PM,,,,,,Algunas veces,Algunas veces,Casi nunca,Casi nunca,Muchas veces,Muchas veces,Casi siempre,Algunas veces,Algunas veces,Muchas veces,Satisfacción,Al aprivar Logica debido a que se me hace difícil y dedique tiempo para poder aprobarla,Decepción,"Perder el promedio del semestre pasado, y desepcionar a mis padres",Disfrute,Lograr culminar la carrera con exito y junto a mis compañeros ,Frustración,"Que todos llevamos dias dedicados para poder sacar el ejercicio, no todos tenemos las mismas capacidades, y se nos complica aprender muy rapido.",Satisfacción,"Por que despues de hacer y deshacer cosas con el proyecto, pudimos llegar a algo en concreto y bien hecho.",Ansiedad,Por que no se si en mi grupo alguno de mis compañeros hizo algun tipo de copia o se huio de un trabajo externo.,Másculino,,,PIMO,,,,,
10353221928,220262807,11/14/2018 01:27:01 PM,11/14/2018 01:43:51 PM,,,,,,Muchas veces,Algunas veces,Casi siempre,Casi siempre,Casi siempre,Casi siempre,Algunas veces,Casi siempre,Algunas veces,Siempre,Alivio,Cuando me entrgaron la definitiva de LCAL senti un gran alivio porque se restauraron mis esperanzas de pasar la asignatura,Frustración,"Durante todos los semestres porque llego con la esperanza de poder aprobar todas las materias inscritas en el semestre pero resulta que, o me toca con profesores que hacen parciales muy dificiles (demasiado), o me toca con profesores que no explican tema o lo explican muy por encima y debo esforzarme mas, pero junto con la demas cargas de las materias es casi imposible. Y en muy pocos caso ocurre que se me hace muy dificil entender y aun asi busque explicación por cualquier medio (universidad , casa, internet, etc) no entiendo.",Satisfacción,"Satisfacción por haber cursado todas las materias, saber que posiblemente pueda tener trabajo con una buena empresa o en el extranjero. Ademas que me gradue junto mis actuales amigos de la universidad.",Aburrimiento,"Que no es justo que no permita una nueva fecha de entrega porque todos le demostramos esfuerzo, pero que aun asi nadie entiende y es tambien muy poco comprensivo de su parte no asignar una nueva fecha de entrega, porque el es el profesor que esta en la labor de hacer que todos sus estudiantes (o la gran mayoria) entiendan el tema, porque para eso le pagan, para enseñar no para hacer que todos pierdan la materia.",Satisfacción,"Le diria que muchas gracias por la ayuda, y que le debo una cerveza por ello.",Temor,"Que siento miedo por lo que el profesor pueda hacer, pero a la vez no porque nunca he copiado y nunca copiare un trabajo.",Másculino,,PIMB,,,,,,
10353207462,220262807,11/14/2018 01:21:37 PM,11/21/2018 09:48:04 AM,,,,,,Algunas veces,Algunas veces,Muchas veces,Muchas veces,Algunas veces,Muchas veces,Algunas veces,Casi siempre,Algunas veces,Muchas veces,Satisfacción,Al recibir las notas del primer corte y vi que pase todo.,Frustración,Al sólo pasar una materia el semestre pasado y no pude hacer nada para salvar las materias.,Satisfacción,Salir de la universidad en 10 semestres terminar mi carrera y poder validar la beca.,Frustración,"Profe, hemos estado intentando resolver el problema por días pero no nos da, y no queremos perder la nota.",Alivio,"Muchas gracias, enserio estaba frustrado ya que no sabíamos el error pero gracias a eso podemos sacar bien el proyecto.",Temor,"Nos van a joder porque hicimos copia, espero el profesor nos de oportunidad con otro trabajo de mejorar esas notas.",Másculino,,,PIMO,,,,,
